{
  "origin": {
    "lat": 40.7433,
    "lng": -73.9196,
    "formatted_address": "4820 Skillman Ave, Sunnyside, NY 11104",
    "geocode_quality": "ROOFTOP"
  },
  "minutes": 10,
  "profile": "driving",
  "polygon": {
    "type": "Polygon",
    "coordinates": [
      [
        [
          -73.881784,
          40.7433
        ],
        [
          -73.883978,
          40.750531
        ],
        [
          -73.891884,
          40.755423
        ],
        [
          -73.902712,
          40.756094
        ],
        [
          -73.911946,
          40.753343
        ],
        [
          -73.916997,
          40.75066
        ],
        [
          -73.9196,
          40.751652
        ],
        [
          -73.924404,
          40.756883
        ],
        [
          -73.934618,
          40.763006
        ],
        [
          -73.948514,
          40.765205
        ],
        [
          -73.960071,
          40.761002
        ],
        [
          -73.963436,
          40.752198
        ],
        [
          -73.957416,
          40.7433
        ],
        [
          -73.946206,
          40.737899
        ],
        [
          -73.935884,
          40.736177
        ],
        [
          -73.929888,
          40.735506
        ],
        [
          -73.927254,
          40.733257
        ],
        [
          -73.924619,
          40.72911
        ],
        [
          -73.9196,
          40.724948
        ],
        [
          -73.91238,
          40.722887
        ],
        [
          -73.904582,
          40.723594
        ],
        [
          -73.897286,
          40.726395
        ],
        [
          -73.89056,
          40.730598
        ],
        [
          -73.88478,
          40.736232
        ],
        [
          -73.881784,
          40.7433
        ]
      ]
    ]
  },
  "area_sq_km": 18.4,
  "provider": "mapbox",
  "traffic_aware": false,
  "generated_at": "2026-08-18T14:02:00+00:00"
}